{
  "adapter_artifact": {
    "adapter_id": "mie.adapter.ollama-chat",
    "artifact_digest": "sha256:328f9415bd338ec162d1352816a003cacf3fdc1dcacd5b3afb8c5e51c155386b",
    "configuration_digest": "sha256:8a9d1306ceadc0a8d2b33be58111fd4c1afc9de82343d30a50920fdba1083152",
    "resolution": "CONFIGURE",
    "sandbox_required": false,
    "trust": "REVIEW_REQUIRED"
  },
  "approval_binding_material": {
    "change_set_digest": "sha256:cbea3329ad211fd942bc8b2b3adbd90919b88c8d541e9ccf765b3ec0da5bc2b5",
    "permission_set_digest": "sha256:4add851b23c801442bcb67ffae019ef660a054ba57da5af1b84ff38128f7f537",
    "policy_digest": "sha256:a019cc3e6c1bfa90ec950dc3183e0971acdf40a9b54af8dc0e4afd5e248e5de5",
    "rollback_plan_digest": "sha256:eacaac1bafec3a7ef46114ca905194641497959aec6767c8ad1157d18c28ab60",
    "target_snapshot_digest": "sha256:8f25169867ab3edb0e2e1e701315a7d9bee80adf51aaecaf825cda467e83a749"
  },
  "artifact_manifest": {
    "artifacts": [
      {
        "artifact_id": "probe-attestation",
        "digest": "sha256:24744f87ec1567c53f38ed9bdbc66f938638c1675081d9ce09e003f5e4289dc9",
        "media_type": "application/json",
        "provenance": {
          "resolver_id": "mie.artifacts.secure-resolver",
          "resolver_version": "0.3.0",
          "run_id": "fixture-sandbox-run",
          "source_relative_path": "probe-attestation.json",
          "source_reported_digest": "sha256:24744f87ec1567c53f38ed9bdbc66f938638c1675081d9ce09e003f5e4289dc9"
        },
        "size_bytes": 17
      }
    ],
    "manifest_digest": "sha256:ca4c7704b28dabfa8ab93cde6199ad01bdee69a0bbc3e9751235f66ab142b348"
  },
  "base_package": {
    "adapter": {
      "adapter_id": "mie.adapter.ollama-chat",
      "configuration_digest": "sha256:18d2239a7f139bad87ba0891c3cb28bb2d3cfce6b5fb736a1adc6156675efbda",
      "contract_version": "normalized-inference-0.1.0",
      "disposition": "CONFIGURE",
      "evidence_ids": [
        "evidence:3a4e0300697d0eac32edb11025b9b1a5",
        "evidence:400266cb5d8c4c58c90720c5a67c329f",
        "evidence:27619d016a2ff6293b83d76e7505752d",
        "evidence:bc574d50faafbd8140dc0a360979f8bb",
        "evidence:5de195f603016fa4fac06b78200524c9",
        "evidence:6ec180942fbaf5268fe177eb77af8d44"
      ],
      "generation_reason": null,
      "limitations": [
        "Validated only for operations represented by passing probe evidence."
      ],
      "origin": "CONFIGURED",
      "required_permissions": [
        "network:http://fixture-ollama.invalid:11434"
      ],
      "source_manifest_digest": "sha256:1b8857dbba40e8f044f02920c3bcfb9908bbd02b238d57b260fb63561989e7c5",
      "supported_operations": [
        "chat",
        "stream",
        "structured_output",
        "tools"
      ],
      "trust": "REVIEW_REQUIRED",
      "validation": "VALIDATED",
      "version": "0.2.0"
    },
    "approval": {
      "actor_id": null,
      "conditions": [
        "Machine lifecycle state is DRAFT_PENDING_APPROVAL; Phase 2 stops here."
      ],
      "decided_at": null,
      "event_ref": null,
      "scope": null,
      "state": "NOT_REQUESTED"
    },
    "artifacts": [
      {
        "artifact_id": "artifact:ollama:eeefcbd39a1d224afbb518f1932725e1",
        "digest": "sha256:aaaaaaaaaaaaaaaaaaaaaaaaaaaaaaaaaaaaaaaaaaaaaaaaaaaaaaaaaaaaaaaa",
        "evidence_ids": [
          "evidence:1b8c4b6a52cc5412b8182a0ebe8e0d1e",
          "evidence:b517ef91edf94119cfc8830e6ec9e696"
        ],
        "file_count": 1,
        "format": "GGUF",
        "media_type": "application/x-gguf",
        "read_only": true,
        "relationships": [],
        "size_bytes": 2500000000,
        "trust": "UNTRUSTED",
        "uri": "ollama-manifest://runtime-ollama-139e4a4e85635d84b2950f96ebdbd2ef/example-model:4b"
      }
    ],
    "assumptions": [
      {
        "assumption_id": "assumption-upstream-revision",
        "evidence_ids": [
          "evidence:1b8c4b6a52cc5412b8182a0ebe8e0d1e",
          "evidence:b517ef91edf94119cfc8830e6ec9e696"
        ],
        "impact": "Logical model identity remains provisional; behavioral evidence is deployment-scoped.",
        "statement": "The runtime content digest corresponds to the intended upstream model revision.",
        "verification_status": "UNVERIFIED"
      }
    ],
    "capabilities": [
      {
        "assessed_at": "2026-08-10T09:00:00Z",
        "capability_class": "MODEL_CAPABILITY",
        "capability_key": "context.handling",
        "claim_id": "claim:5cc96173c4ce4b8bf2e0ad114bb7319e",
        "contradictions": [],
        "evidence_ids": [
          "evidence:6ec180942fbaf5268fe177eb77af8d44"
        ],
        "evidence_levels": [
          "VALIDATED_BY_TEST"
        ],
        "limitations": [
          "Validated only under the recorded probe profile."
        ],
        "parameters": {
          "adapter_id": "mie.adapter.ollama-chat",
          "configuration_digest": "sha256:18d2239a7f139bad87ba0891c3cb28bb2d3cfce6b5fb736a1adc6156675efbda",
          "environment_id": "env:registry-fixture",
          "probe_id": "probe:d178351377ee5242dd23f6e9ba09a03e"
        },
        "policy_version": "probe-policy-0.2.0",
        "subject": {
          "digest": "sha256:5e799adf3b2d7fecdb033721e2712d52bf595756464fbe7875eb7c048a5389c2",
          "kind": "DEPLOYMENT",
          "subject_id": "deployment:ollama:39a3d39b2ef41d304c3f9606945da0a9",
          "version": null
        },
        "support": "SUPPORTED",
        "validation": "VALIDATED"
      },
      {
        "assessed_at": "2026-08-10T09:00:00Z",
        "capability_class": "MODEL_CAPABILITY",
        "capability_key": "context.long",
        "claim_id": "claim:ccfbfe7cc1c2d46af07c6014ab1ebc34",
        "contradictions": [],
        "evidence_ids": [
          "evidence:dc97e29dfd7adfe268089c101a9cee65"
        ],
        "evidence_levels": [
          "DETECTED_FROM_METADATA"
        ],
        "limitations": [
          "Declared context metadata only; usable context is not validated."
        ],
        "parameters": {
          "declared_context_length": 65536,
          "threshold": 32768
        },
        "policy_version": "capability-hypotheses-0.2.0",
        "subject": {
          "digest": "sha256:5e799adf3b2d7fecdb033721e2712d52bf595756464fbe7875eb7c048a5389c2",
          "kind": "DEPLOYMENT",
          "subject_id": "deployment:ollama:39a3d39b2ef41d304c3f9606945da0a9",
          "version": null
        },
        "support": "SUPPORTED",
        "validation": "UNVALIDATED"
      },
      {
        "assessed_at": "2026-08-10T09:00:00Z",
        "capability_class": "MODEL_CAPABILITY",
        "capability_key": "generation.embeddings",
        "claim_id": "claim:9087b7f15303bc5b86094eb3c15d9047",
        "contradictions": [],
        "evidence_ids": [
          "evidence:761e38e027ec716fd03257789c91d734"
        ],
        "evidence_levels": [
          "INFERRED"
        ],
        "limitations": [
          "No affirmative declaration or behavioral validation was found."
        ],
        "parameters": {},
        "policy_version": "capability-hypotheses-0.2.0",
        "subject": {
          "digest": "sha256:5e799adf3b2d7fecdb033721e2712d52bf595756464fbe7875eb7c048a5389c2",
          "kind": "DEPLOYMENT",
          "subject_id": "deployment:ollama:39a3d39b2ef41d304c3f9606945da0a9",
          "version": null
        },
        "support": "UNKNOWN",
        "validation": "UNVALIDATED"
      },
      {
        "assessed_at": "2026-08-10T09:00:00Z",
        "capability_class": "MODEL_CAPABILITY",
        "capability_key": "generation.text",
        "claim_id": "claim:8f2bc6014f173ac9bfa7dd6c28713b2f",
        "contradictions": [],
        "evidence_ids": [
          "evidence:687e2b1631b3a08690197109add0793f",
          "evidence:3a4e0300697d0eac32edb11025b9b1a5"
        ],
        "evidence_levels": [
          "DETECTED_FROM_METADATA",
          "VALIDATED_BY_TEST"
        ],
        "limitations": [
          "Runtime/model-detail declaration only; behavior is not validated.",
          "Validated only under the recorded probe profile."
        ],
        "parameters": {
          "adapter_id": "mie.adapter.ollama-chat",
          "configuration_digest": "sha256:18d2239a7f139bad87ba0891c3cb28bb2d3cfce6b5fb736a1adc6156675efbda",
          "environment_id": "env:registry-fixture",
          "probe_id": "probe:1e83815becfaacbf47fd72682fd6ae08",
          "runtime_declaration": "completion"
        },
        "policy_version": "probe-policy-0.2.0",
        "subject": {
          "digest": "sha256:5e799adf3b2d7fecdb033721e2712d52bf595756464fbe7875eb7c048a5389c2",
          "kind": "DEPLOYMENT",
          "subject_id": "deployment:ollama:39a3d39b2ef41d304c3f9606945da0a9",
          "version": null
        },
        "support": "SUPPORTED",
        "validation": "VALIDATED"
      },
      {
        "assessed_at": "2026-08-10T09:00:00Z",
        "capability_class": "MODEL_CAPABILITY",
        "capability_key": "instruction.following",
        "claim_id": "claim:1adf8b4215a3a969904716971dffb9f1",
        "contradictions": [],
        "evidence_ids": [
          "evidence:a5ad741837463ff917ae075c97cff818",
          "evidence:400266cb5d8c4c58c90720c5a67c329f"
        ],
        "evidence_levels": [
          "INFERRED",
          "VALIDATED_BY_TEST"
        ],
        "limitations": [
          "Requires behavioral validation.",
          "Validated only under the recorded probe profile."
        ],
        "parameters": {
          "adapter_id": "mie.adapter.ollama-chat",
          "configuration_digest": "sha256:18d2239a7f139bad87ba0891c3cb28bb2d3cfce6b5fb736a1adc6156675efbda",
          "environment_id": "env:registry-fixture",
          "probe_id": "probe:d805f0b2ddc4f5e784b3bc0f1efdb4df"
        },
        "policy_version": "probe-policy-0.2.0",
        "subject": {
          "digest": "sha256:5e799adf3b2d7fecdb033721e2712d52bf595756464fbe7875eb7c048a5389c2",